{
  "purpose": "NON_DESIGN_INTERFACE_VERIFICATION",
  "run_id": "GAS-WALL-SYNTHETIC-001",
  "case_id": "NON_DESIGN_SYNTHETIC_GAS_WALL",
  "geometry_version": "SYNTHETIC-GEOMETRY-V1",
  "segment_id": "SYN-GW-01",
  "spatial_basis": "ONE_SYNTHETIC_SEGMENT",
  "model_scope": "STEADY_SINGLE_SEGMENT_GAS_WALL",
  "formula_version": "RPA_2012_BASIC_BARTZ",
  "formula_source": "RPA Thermal Analysis documentation (2012), Basic Bartz equation, page 7",
  "cea_run_artifact": "../artifacts/phase1/cea_rp1311_example13_rocket_run.json",
  "chamber_station_index": 0,
  "cea_station_index": 3,
  "transport_basis": "frozen",
  "geometry": {
    "throat_diameter_m": 0.1,
    "throat_diameter_source": "synthetic non-design fixture; not SPACE Y geometry",
    "bartz_curvature_radius_m": 0.15,
    "bartz_curvature_radius_source": "synthetic non-design fixture; not SPACE Y geometry",
    "gas_area_m2": 0.01,
    "gas_area_source": "synthetic non-design fixture; not SPACE Y geometry",
    "coolant_area_m2": 0.02,
    "coolant_area_source": "synthetic non-design fixture; not SPACE Y geometry",
    "wall_thickness_m": 0.002,
    "wall_thickness_source": "synthetic non-design fixture; not SPACE Y wall thickness",
    "wall_conductivity_W_mK": 20.0,
    "wall_conductivity_source": "synthetic constant used only for arithmetic verification; not a material property selection",
    "wall_conduction_area_m2": 0.01,
    "wall_conduction_area_source": "synthetic non-design fixture; not SPACE Y geometry"
  },
  "radiation": {
    "definition": "EXPLICIT_NET_RATE_GAS_TO_WALL_POSITIVE",
    "q_rad_net_W": 1000.0,
    "source": "explicit synthetic nonzero rate for energy-balance testing; not an engine radiation estimate"
  },
  "coolant_side_boundary": {
    "mode": "PRESCRIBED_FILM_COEFFICIENT_AND_BULK_TEMPERATURE",
    "h_c_W_m2K": 5000.0,
    "h_c_source": "synthetic Robin boundary for coupling verification; no coolant correlation claim",
    "bulk_temperature_K": 300.0,
    "bulk_temperature_source": "synthetic Robin boundary for coupling verification; not a coolant inlet condition"
  },
  "numerics": {
    "max_iterations": 100,
    "relaxation": 0.5,
    "wall_temperature_tolerance_K": 1e-8,
    "energy_residual_tolerance_W": 1e-8,
    "initial_gas_side_wall_temperature_K": 1000.0,
    "initial_temperature_source": "synthetic initial iterate only; not a predicted or allowable wall temperature"
  }
}
